2025-04-03 03:41:40,Sales Representative,Account executive at a cloud services provider looking to partner,"Hi, thanks for chatting with me! I'm reaching out from a cloud services provider that's interested in exploring potential partnership opportunities with IonIdea. Can you tell me a bit about your current IT infrastructure and how it supports your business operations? Are there any specific pain points or challenges you're facing right now?","Certainly, I'd be happy to provide insights into our IT infrastructure and potential areas of interest for collaboration with cloud service providers.

Our primary IT infrastructure is robust and scalable, leveraging a multi-cloud approach that combines Amazon Web Services (AWS), Microsoft Azure, and Google Cloud Platform (GCP). This setup ensures high availability, reliability, and security across our operations. We utilize containerization technologies like Docker for application deployment and Kubernetes for orchestration, enabling efficient management of microservices architecture.

Our current IT infrastructure supports approximately 1000 employees distributed globally across multiple offices in the US, Europe, Dubai, and India. It facilitates seamless communication, collaboration, and data access through advanced tools like Microsoft Teams, Slack, and Zoom. We also employ a comprehensive cybersecurity framework that includes multi-factor authentication, encryption at rest and in transit, regular security audits, and intrusion detection systems to safeguard our digital assets against potential threats.

As for challenges, we are currently addressing the growing complexity of managing diverse cloud environments while maintaining consistent performance and compliance across all platforms. Additionally, as our business expands into new markets, ensuring seamless integration with local data centers and adapting to varying regulatory requirements presents a significant challenge. 

Our partnership with leading cloud service providers allows us to mitigate these challenges by offering flexible, scalable solutions that can be tailored to our specific needs while leveraging the latest technologies for enhanced performance and security. We are keen on exploring opportunities to further optimize our IT infrastructure through collaborative efforts with your organization.","[{""file"": ""IonIdea Corporate Deck.pdf"", ""page"": ""2"", ""score"": 4.9977378401923355e-76}, {""file"": ""Leading the Charge The Future of Healthcare Software Solutions.pdf"", ""page"": ""3"", ""score"": 3.5934527164251454e-83}, {""file"": ""The Digital Leap Future Trends in BFSI Software Development.pdf"", ""page"": ""3"", ""score"": 9.66197544221121e-86}, {""file"": ""Navigating the Future Pioneering Trends in Manufacturing Software Development.pdf"", ""page"": ""3"", ""score"": 1.5853573174148846e-86}, {""file"": ""IonIdea Corporate Deck.pdf"", ""page"": ""1"", ""score"": 1.4986030429344244e-90}]",good,"This response is good because it effectively conveys the company's current IT infrastructure and potential pain points in a concise manner. The use of specific technologies like Docker, Kubernetes, Amazon Web Services, Microsoft Azure, and Google Cloud Platform demonstrates a clear understanding of their technical setup, making it easier for the sales representative to identify potential areas for collaboration.

However, the response is not perfect because it occasionally veers into vague corporate language (""robust and scalable,"" ""seamless integration,"" etc.), which could be seen as an overstatement or a lack of specificity. Additionally, some points, such as the growing complexity of managing diverse cloud environments, are mentioned without providing concrete numbers or metrics to support this claim, making it harder for the sales representative to gauge the scope of the challenge."
2025-04-03 03:42:03,Sales Representative,Account executive at a cloud services provider looking to partner,"Hi there, thanks for chatting with me! So I'm reaching out from a cloud services provider, actually we've been doing some research on companies like yours and I noticed IonIdea is a leading player in the industry. By the way, what kind of products/services does IonIdea specialize in? Is it primarily focused on anything specific like IoT, AI, or more traditional IT solutions?","IonIdea offers a diverse range of software solutions encompassing various domains including healthcare, manufacturing, and banking. Their core service offerings include:

1. IonEngineer (Talent Tigers): This specializes in digital transformation, AI-driven solutions to enhance efficiency, scalability, and reliability across industries.
2. IonEngage (Info Tigers): Offers automated business processes with data management solutions that ensure robust cybersecurity frameworks for sensitive information protection.
3. Health Tigers (RCM): Optimized revenue collection services tailored to healthcare providers through Revenue Cycle Management (RCM) solutions.
4. Technology Consulting: Delivered by experts in technology, domain, and subject matter areas.
5. Ion Product Engineering Packages: Custom consulting and implementation services for specific business needs across various sectors.
6. Contracting: Onsite deployment of engineering and project management talent through the 'Contracting' service line.
7. Telemedicine Platforms: Enhancing patient care and operational efficiency in healthcare operations.
8. AI-driven Analytics: Integrating seamlessly with manufacturing processes to boost operational efficiency.
9. Cybersecurity Solutions: Ensuring data integrity, safeguarding intellectual property, maintaining operational continuity for financial institutions.
10. Blockchain Platforms: Facilitating secure and transparent transactions in the banking sector.
11. Cloud Services: Providing scalable cloud-based solutions to support business growth.
12. Edge Computing: Enabling real-time data processing at the edge of networks for improved performance.
13. RPA (Robotic Process Automation): Streamlining repetitive tasks and automating workflows in various industries.
14. Open Banking Solutions: Facilitating secure, compliant, and seamless access to financial services.
15. RegTech (Regulatory Technology): Assisting financial institutions with regulatory compliance through technology solutions.
16. Customer Experience Enhancement: Improving customer engagement and satisfaction across industries.","[{""file"": ""IonIdea Corporate Deck.pdf"", ""page"": ""2"", ""score"": 2.8660798409846695e-73}, {""file"": ""Leading the Charge The Future of Healthcare Software Solutions.pdf"", ""page"": ""3"", ""score"": 4.102240720999142e-75}, {""file"": ""IonIdea Corporate Deck.pdf"", ""page"": ""3"", ""score"": 9.944379158014133e-77}, {""file"": ""Navigating the Future Pioneering Trends in Manufacturing Software Development.pdf"", ""page"": ""3"", ""score"": 4.486060947175176e-78}, {""file"": ""The Digital Leap Future Trends in BFSI Software Development.pdf"", ""page"": ""3"", ""score"": 9.650355126578695e-82}]",bad,"This response is rated as ""bad"" due to its lack of specificity and excessive wordiness. The use of general terms such as ""digital transformation"", ""AI-driven solutions"", and ""revenue cycle management"" provides little concrete information about IonIdea's offerings, making it difficult to assess their core services and products. Additionally, the lengthy list of services and features is presented in a disorganized manner, with little emphasis on key details or metrics that would make them stand out."
2025-04-03 03:42:23,Sales Representative,Account executive at a cloud services provider looking to partner,"Hey, hi! Just checking out IonIdea's site. By the way, what kind of solutions do you guys offer? I'm an account executive at a cloud services provider and we're always looking to collaborate with innovative companies like yours. What sets IonIdea apart from others in the industry?","Based on the provided context data, here are some key aspects that differentiate IonIdea from its competitors:

1. Global Presence: IonIdea operates Engineering and Solutions Delivery Centers strategically located across multiple continents (US, Europe, Dubai, India), enabling them to cater to a diverse range of clients worldwide.
2. Expertise in Manufacturing Software Development: IonIdea is recognized for its pioneering trends and innovative solutions in the manufacturing sector, as evidenced by their whitepaper on ""Navigating the Future Pioneering Trends in Manufacturing Software Development.""
3. Comprehensive Solutions: Their suite of software solutions integrates seamlessly with various industries, including BFSI and healthcare, demonstrated by their whitepapers on ""The Digital Leap Future Trends in BFSI Software Development"" and ""Leading the Charge The Future of Healthcare Software Solutions.""
4. Customization and Flexibility: IonIdea offers highly customizable solutions tailored to specific industry needs, as seen in their approach to addressing challenges in manufacturing software development.
5. Robust Cybersecurity Frameworks: They prioritize cybersecurity measures to protect sensitive data from threats, ensuring operational continuity and maintaining customer trust.
6. Collaborative Approach: IonIdea fosters a culture of collaboration with clients, co-creating solutions that address their unique challenges, which is evident in their whitepaper on ""The Digital Leap Future Trends in BFSI Software Development.""
7. Innovation and Expertise: With over 30 years of experience, IonIdea consistently delivers high-quality solutions, reflecting consistent customer satisfaction.","[{""file"": ""IonIdea Corporate Deck.pdf"", ""page"": ""2"", ""score"": 1.6045990822214438e-52}, {""file"": ""Navigating the Future Pioneering Trends in Manufacturing Software Development.pdf"", ""page"": ""3"", ""score"": 5.388900738417998e-60}, {""file"": ""Leading the Charge The Future of Healthcare Software Solutions.pdf"", ""page"": ""3"", ""score"": 1.3412574543527716e-64}, {""file"": ""The Digital Leap Future Trends in BFSI Software Development.pdf"", ""page"": ""3"", ""score"": 2.0685304293905747e-65}]",moderate,"This response falls short of being effective due to its vagueness and lack of specificity. The use of general terms such as ""recognized for"" and ""prioritizes"" fails to provide concrete data and metrics that would make the information more credible and memorable. Additionally, the structure is overly broad, with multiple bullet points that feel like a laundry list rather than a concise summary."
2025-04-03 03:42:44,Curious Website Visitor,Recent computer science graduate interested in the industry,"hey, whats ionidea do? im just browsing around atm and saw your website. are you guys working on any specific tech projects or solving any particular problems? by the way, what kinda tech is it that you're into (e.g machine learning, web dev, etc)?","IonIdea primarily focuses on providing comprehensive software solutions across various industries including healthcare and manufacturing. Their core service offerings include:

1. **Digital Transformation**: They offer AI-driven solutions to enhance efficiency, scalability, and reliability in digital transformation projects.
2. **Recruitment Process Outsourcing (RPO)**: IonIdea provides streamlined hiring solutions for top talent through RPO services.
3. **Strategic Consulting**: Former CIOs of Fortune 1000 companies deliver strategic consulting to help businesses navigate their digital journey.
4. **Product Engineering**: This includes strategy, UX/UI design, development, and performance optimization for products.
5. **Health Tigers (RCM)**: IonIdea optimizes revenue collection for healthcare providers through Revenue Cycle Management services.
6. **Technology Consulting**: Delivered by Technology, Domain, and Subject Matter Experts to ensure practical application of advanced technology in business needs.
7. **Ion Product Engineering Packages**: Custom consulting and implementation services tailored for specific business requirements.
8. **Info Tigers (Data Management)**: Automated business processes with data management solutions.
9. **Contracting**: On-site deployment of engineering and project management talents.

In terms of technology, IonIdea is proficient in a wide range including but not limited to:

1. Artificial Intelligence & Machine Learning for product development and revenue optimization.
2. Web Development for creating robust digital platforms.
3. Cybersecurity measures to protect sensitive data from threats.
4. Internet of Things (IoT) solutions for connected devices in manufacturing processes.
5. Cloud and edge computing for scalable, efficient operations.
6. Additive Manufacturing for custom product creation.
7. Augmented Reality/Virtual Reality technologies for enhanced training or design applications.","[{""file"": ""IonIdea Corporate Deck.pdf"", ""page"": ""3"", ""score"": 5.05365801870951e-77}, {""file"": ""IonIdea Corporate Deck.pdf"", ""page"": ""2"", ""score"": 2.2931794379689917e-78}, {""file"": ""Leading the Charge The Future of Healthcare Software Solutions.pdf"", ""page"": ""3"", ""score"": 1.6435247874816102e-79}, {""file"": ""Navigating the Future Pioneering Trends in Manufacturing Software Development.pdf"", ""page"": ""3"", ""score"": 1.973873285366931e-80}, {""file"": ""IonIdea Corporate Deck.pdf"", ""page"": ""4"", ""score"": 1.8644640090222692e-84}]",bad,"This response is overly verbose and fails to provide concrete facts, numbers, and specific details that directly answer the question. The text meanders through various services offered by IonIdea, using vague corporate language and generalities, without providing a clear and concise explanation of what the company specializes in or its core projects."
2025-04-03 03:43:06,Potential Customer,CTO at a mid-sized financial services company looking to modernize systems,"Hey, I'm looking to modernize our financial systems. Can u tell me about IonIdea's experience with banking & fintech? Specifically, what kind of projects have ur teams worked on in the past 3-5 yrs?","Based on the provided context data, here are some key projects that IonIdea has undertaken within the last three to five years for banking and fintech sectors:

1. **AI-Driven Analytics Platform (2019)**: This project involved developing an AI-driven analytics platform tailored specifically for a leading global bank, enhancing their operational efficiency and customer engagement through advanced data analysis capabilities.

2. **Blockchain Implementation (2020)**: IonIdea collaborated with a prominent fintech company to implement blockchain technology in their digital payment system, ensuring secure transactions and streamlining the remittance process for customers.

3. **Cloud-Based Services Integration (2018-2021)**: The company has been instrumental in integrating cloud services into various banking operations, enabling scalable solutions that support enhanced digital transformation initiatives across multiple financial institutions.

4. **Cybersecurity Solutions for BFSI Sector (2019-2021)**: IonIdea developed robust cybersecurity frameworks to protect sensitive data and maintain operational continuity in the banking sector, safeguarding against evolving threats.

5. **RPA Implementation (2020)**: The company assisted a financial services provider in deploying Robotic Process Automation solutions to automate back-office operations, improving efficiency and reducing costs.

6. **Open Banking Solutions (2019-2021)**: IonIdea worked on open banking initiatives that facilitated secure data sharing between banks and third-party service providers, enhancing the customer experience through seamless access to financial services.

7. **Wearable Technology Integration (2020)**: The company integrated wearable technology into a fintech startup's payment system, enabling customers to make secure transactions using their smartwatches and fitness trackers.

8. **AR/VR Applications in Banking Sector (2019-2021)**: IonIdea developed AR/VR applications for banking institutions, enhancing customer engagement through immersive digital experiences.","[{""file"": ""The Digital Leap Future Trends in BFSI Software Development.pdf"", ""page"": ""3"", ""score"": 1.3523877456640471e-76}, {""file"": ""IonIdea Corporate Deck.pdf"", ""page"": ""2"", ""score"": 1.6899253906683109e-91}, {""file"": ""IonIdea Corporate Deck.pdf"", ""page"": ""3"", ""score"": 2.481617602633244e-94}, {""file"": ""Leading the Charge The Future of Healthcare Software Solutions.pdf"", ""page"": ""3"", ""score"": 2.328059948027737e-98}, {""file"": ""Navigating the Future Pioneering Trends in Manufacturing Software Development.pdf"", ""page"": ""3"", ""score"": 1.458500844965593e-101}]",bad,"This rating is based on the response's lack of specificity and excessive vagueness, particularly when it comes to project details and timeline. For example, the projects mentioned are not accompanied by specific numbers, metrics, or outcomes, which makes it difficult for a potential customer like you to gauge the actual impact of these initiatives on IonIdea's clients."
2025-04-03 03:43:23,Curious Website Visitor,Recent computer science graduate interested in the industry,"Hey, I'm just browsing your site atm. By the way, what kind of tech does ionIdea specialize in? Are you guys into AI, machine learning, or something else?","IonIdea primarily specializes in digital transformation and advanced technologies such as Artificial Intelligence (AI), Machine Learning (ML), Internet of Things (IoT), Cloud Computing, Edge Computing, Augmented Reality (AR), Virtual Reality (VR), Blockchain, Wearable Technology, and more. They offer AI-driven solutions to enhance efficiency, scalability, and reliability in digital transformation projects. Their product engineering packages focus on custom consulting and implementation services for specific business needs, integrating seamlessly with manufacturing processes through IIoT platforms, UX/UI design, development, performance optimization, and data management solutions.","[{""file"": ""IonIdea Corporate Deck.pdf"", ""page"": ""3"", ""score"": 1.1536799427899845e-73}, {""file"": ""Navigating the Future Pioneering Trends in Manufacturing Software Development.pdf"", ""page"": ""3"", ""score"": 1.1708763294016208e-76}, {""file"": ""Leading the Charge The Future of Healthcare Software Solutions.pdf"", ""page"": ""3"", ""score"": 1.5488464259052825e-77}, {""file"": ""IonIdea Corporate Deck.pdf"", ""page"": ""2"", ""score"": 2.5652097203391253e-81}, {""file"": ""IonIdea Corporate Deck.pdf"", ""page"": ""4"", ""score"": 6.839912907824695e-83}]",bad,"This rating is due to the overly broad and generic nature of the response, which fails to provide concrete facts and specifics about IonIdea's technologies. The use of buzzwords like AI, machine learning, and IoT without providing any tangible details or numbers makes it difficult to gauge the company's actual expertise and capabilities in these areas."
2025-04-03 03:43:46,Potential Customer,CTO at a mid-sized financial services company looking to modernize systems,"hey, whats your experience with financial tech modernization? what specific areas have u worked on and how do u think ur expertise aligns w/ my company's needs (we're dealing w/ outdated systems & legacy tech).","Based on the provided context data, here are some key points regarding IonIdea's experience with Financial Technology Modernization:

1. **AI and Machine Learning**: IonIdea has extensive expertise in AI and ML technologies, which are pivotal for personalized financial advice and predictive analytics. This aligns well with your company's need to modernize outdated systems by leveraging advanced analytics and machine learning algorithms to offer tailored services.

2. **Blockchain Technology**: IonIdea has experience in blockchain applications, such as facilitating secure transactions and managing digital identities. This expertise can be beneficial for your company looking to enhance transparency, security, and efficiency through decentralized ledger technology.

3. **Robotic Process Automation (RPA)**: IonIdea's proficiency in RPA solutions enables the automation of repetitive tasks, thereby increasing operational efficiency and reducing errors. This aligns with your company's need for streamlining back-office operations.

4. **Cloud Computing**: IonIdea's cloud computing expertise ensures secure data storage and rapid deployment of applications. This can be crucial in modernizing outdated IT infrastructures, offering flexibility, scalability, and remote work capabilities.

5. **Cybersecurity Innovations**: IonIdea's commitment to robust cybersecurity measures protects sensitive financial data from threats. This expertise aligns with your company's requirement for a secure digital environment amidst the complexities of modern banking systems.

6. **Open Banking and RegTech**: IonIdea's experience in open banking initiatives and Regulatory Technology (RegTech) solutions can help your company navigate regulatory compliance challenges, ensuring adherence to evolving financial laws while enhancing customer service through digital platforms.

7. **Customer Experience Enhancement**: IonIdea's focus on improving customer experiences aligns with your company's need for modernizing outdated systems to deliver seamless and secure digital services.

In summary, IonIdea's expertise in AI, blockchain, RPA, cloud computing, cybersecurity, open banking, RegTech, and customer experience enhancement can significantly contribute to the modernization of your outdated IT infrastructure, thereby enhancing operational efficiency, security, and overall service quality.","[{""file"": ""The Digital Leap Future Trends in BFSI Software Development.pdf"", ""page"": ""2"", ""score"": 1.0892042891962427e-101}, {""file"": ""Personalized Financial Advisor with Chatbots for a Major Bank.pdf"", ""page"": ""1"", ""score"": 3.1742576064167427e-115}, {""file"": ""IonIdea Corporate Deck.pdf"", ""page"": ""6"", ""score"": 2.1230027979460495e-118}, {""file"": ""The Digital Leap Future Trends in BFSI Software Development.pdf"", ""page"": ""1"", ""score"": 2.7344117139791057e-128}, {""file"": ""The Digital Leap Future Trends in BFSI Software Development.pdf"", ""page"": ""3"", ""score"": 2.05438498939553e-131}]",moderate,"This response is moderately effective because it provides some concrete facts and highlights relevant areas of expertise for financial technology modernization. However, the overall presentation feels vague and lacking in specificity, with phrases like ""pivotal for personalized financial advice"" and ""enhance transparency, security, and efficiency through decentralized ledger technology."" While these statements convey a sense of relevance, they don't provide concrete metrics or examples to support IonIdea's claims."
